{
  "schema_version": "1.0",
  "plan_id": "cleanup-002",
  "generated_at": "2026-08-28T15:11:00Z",
  "repository": {
    "root": "/tmp/test-steward/task-04",
    "revision": "c0ffee",
    "diff_fingerprint": "sha256:clean"
  },
  "candidates": [
    {
      "id": "cand-static-overlap",
      "test_paths": [
        "test/formatter-a.test.ts",
        "test/formatter-b.test.ts"
      ],
      "remove_paths": [],
      "retain_paths": [],
      "action": "MERGE_CANDIDATE",
      "obligation_ids": [],
      "obligation_preservation": [],
      "structural_signals": [
        "ev-similar-ast",
        "ev-shared-assertion-shape"
      ],
      "independent_signals": [],
      "protected_checks": [
        {
          "source": ".detestify/protected-tests.json",
          "passed": true,
          "detail": "No protected record references either path."
        }
      ],
      "counterfactual": {
        "status": "not_run",
        "commands_ref": null,
        "candidate_id": null,
        "remove_paths": [],
        "retain_paths": [],
        "preserved_obligations": [],
        "limitations": [
          "Repository commands were not trusted."
        ]
      },
      "worktree_validation": {
        "status": "not_run",
        "worktree_ref": null,
        "revision": null,
        "cleanup_complete": true
      },
      "human_approval": {
        "required": true,
        "status": "not_requested",
        "approver_ref": null
      },
      "rationale": "Static similarity suggests consolidation, but no independent behavioral or historical signal establishes safe deletion.",
      "limitations": [
        "Obligation ownership is unknown."
      ]
    }
  ],
  "limitations": [
    "Static-only evidence cannot produce DELETE_CANDIDATE."
  ]
}
